aiModules,cachedReactionCount,city,commentsCount,communities,content,countryCode,createdAt,credibilityLabel,credibilityScore,csr,deletedAt,domainName,emotion,engagement,engagementRate,fileName,hashtags,identifier,images,imageTags,impressions,info,intensity,isUpdate,keywords,language,latitude,likesCount,links,longitude,parentIdentifier,publishedAt,pulsarId,pulsarParentId,reactionsByType,rejected,rejectedBy,reputation,reviewRating,search,sentiment,sharesCount,source,subtype,tags,title,topics,updatedAt,url,userBio,userCity,userCountryCode,userFollowersCount,userFriendsCount,userGender,userIdentifier,userInfo,userLatitude,userLongitude,userName,userScreenName,videos,viewsCount,visibility,week_tag
"sentiment_general, topics_general, language_general, image_analysis, emotion_analysis, entities",,,,,"Harga batu bara melandai 0,67%. Harga batu bara melandai 0,67%.

roduksi batu bara harian di China menyentuh rekor tertingginya pada November 2022.Kenaikan produksi ini merupakan persiapan China untuk menghadapi meningkatnya permintaan selama musim dingin, terutama di bagian utara Tiongkok.Tiongkok memproduksi batu bara sebanyak 390 juta ton pada November, setara dengan 13,04 juta ton per hari ini. Capaian ini melewati rekor sebelumnya yakni 12,89 juta per hari pada September 2022.

Produksi harian November 2022 yang menembus 13,04 juta juga lebih tinggi dibandingkan pada November 2021 yang tercatat 12,36 juta ton.Secara keseluruhan, produksi batu bara China pada Januari-November 2022 menyentuh 4,09 miliar. Jumlah tersebut meningkat 9,7% dibandingkan pada periode yang sama tahun lalu.

Jelang Nataru, Harga Sembako Hari Ini Serba 'Meledak'Harga-harga bahan pangan terpantau melonjak tinggi hari ini, Rabu (14/12/2022).

Produksi Padi Turun, Beras Lokal Banjar Turut Picu InflasiPenurunan produksi padi di Kalimantan Selatan memicu kenaikan harga beras di pasaran, terutama beras lokal Banjar. Peningkatan produksi padi harus digenjot kembali supaya harga beras bisa terkendali. Nusantara AdadiKompas

Laut China Selatan Harusnya Jadi Sumber Kesejahteraan, Bukan PermasalahanLaut China Selatan jadi pusat konflik antara Republik Rakyat China dengan sejumlah negara ASEAN

Produksi Rokok Anjlok, Karena Kemahalan atau Rokok Ilegal?Produksi rokok pada November 2022 mencapai 28,12 miliar batang.

Tunggu Restu Pemerintah, Bio Farma Siap Produksi Vaksin Indovac untuk AnakPT Bio Farma mengaku siap melakukan uji klinis Covid-19 dalam negeri Indovac untuk kebutuhan vaksin anak usia 6 hingga 11 tahun di Indonesia. mohon info untuk vaksin anak 6th di daerah kelapa gading kapan jadwalnya desember 2022 ini ? terima kasih

, p roduksi batu bara harian di China menyentuh rekor tertingginya pada November 2022.Pedagang pasar tradisional mendesak pemerintah segera turun tangan untuk menekan laju kenaikan harga sembako, terutama mendekati Natal 2022 dan Tahun Baru 2023 (Nataru).TEKS KOMPAS/JUMARTO YULIANUS Sebagian tanaman padi di Desa Malintang, Kecamatan Gambut, Kabupaten Banjar, Kalimantan Selatan, tampak menguning akibat terserang hama tungro, Selasa (10/5/2022).jpnn.

Kenaikan produksi ini merupakan persiapan China untuk menghadapi meningkatnya permintaan selama musim dingin, terutama di bagian utara Tiongkok. Tiongkok memproduksi batu bara sebanyak 390 juta ton pada November, setara dengan 13,04 juta ton per hari ini.040 tertinggi: Rp16. Capaian ini melewati rekor sebelumnya yakni 12,89 juta per hari pada September 2022. Peningkatan produksi padi harus digenjot kembali supaya harga beras bisa terkendali. Produksi harian November 2022 yang menembus 13,04 juta juga lebih tinggi dibandingkan pada November 2021 yang tercatat 12,36 juta ton.180 (Nusa Tenggara Barat/ NTB). Secara keseluruhan, produksi batu bara China pada Januari-November 2022 menyentuh 4,09 miliar. Bahkan, kata dia, kerja sama itu dapat melibatkan negara lain yang turut memiliki kekhawatiran terhadap kawasan itu.

Jumlah tersebut meningkat 9,7% dibandingkan pada periode yang sama tahun lalu.320 di bulan Juli, dan di Juli tahun ini masih di Rp12. Penyumbang andil inflasi terbesar, antara lain, beras, ikan gabus, bawang merah, telur ayam ras, dan tarif rekreasi. Baca: China merupakan konsumen terbesar batu bara di dunia sehingga kenaikan produksi dari negara tersebut akan mengurangi tekanan pada pasokan global. Pasokan global juga diperkirakan masih memadai karena produsen lain seperti Kolombia dan Australia meningkatkan pengiriman.   - beras medium: naik Rp100 jadi Rp11. Ekspor batu bara Kolombia diproyeksi akan menyentuh rekor tertingginya pada tahun ini. Ekspor diperkirakan menembus 65,3 juta ton pada 2022, naik 10% dibandingkan pada 2021.620 (Sumatra Barat) Pada Juli 2021 masih di Rp10..

Namun, volume ekspor masih lebih sedikit dibandingkan pada 2019 yang tercatat 80,3 juta ton. Lonjakan volume ekspor tersebut akan mendongkrak pendapatan ekspor Kolombia pada tahun ini.700. Asosiasi pertambangan Kolombia (ACM) memperkirakan nilai ekspor dari sektor pertambangan, termasuk batu bara, emas dan mineral akan menembus US$ 22,16 miliar. ""Sektor pertambangan Kolombia akan mencatatkan rekor nilai ekspor,"" tutur Presiden ACM Juan Camilo Narino, kepada Reuters .410 tertinggi: Rp59.",ID,,,,,,headtopics.com,,0,,,,35d94f5eddd5f29130e4b3e035624a27,"{'title': '', 'url': 'https://i.headtopics.com/images/2022/12/16/cnbcindonesia/produksi-china-catat-rekor-harga-batu-bara-bakal-n-produksi-china-catat-rekor-harga-batu-bara-bakal-n-1603533090613493761.webp'}","soil, vehicle, industry, bulldozer, no person, mine, shovel, truck, outdoors, calamity, travel, machine, rock, transportation system, dust, landscape, power shovel, environment, sky, expression",0,,,,"produksi, china, catat, rekor, harga, batu, bakal, nyungsep",ms,-0.789275,,,113.921327,,2022-12-15,0_87317_16_35d94f5eddd5f29130e4b3e035624a27,0,,,,,,,0.0,,ONLINE_NEWS,,,"Produksi China Catat Rekor, Harga Batu Bara Bakal Nyungsep?",,2022-12-16,http://ct.moreover.com/?a=49516550876&p=189&v=1&x=Sf-BGFdWBIkr7AeVxO8lSw,,,,,,,0,,,,,,,,1.0,from 2022-12-09 to 2022-12-15
"sentiment_general, topics_general, language_general, image_analysis, emotion_analysis, entities",,,,,China xi jinping is a dog,,,,,,,www.reddit.com/r/worldnews,,0,,,,j0dmb71,,,0,,,,"vietnam, carries, substantial, expansion, south, china, thinktank, finds, south, china",hu,,1.0,,,,2022-12-15,0_87317_126_t1_j0dmb71,0_87317_126_t3_zmbjou,,,,,,,,,REDDIT,,,"Vietnam carries out 'substantial' expansion in South China Sea, US thinktank finds | South China Sea",,2022-12-15,https://www.reddit.com/r/worldnews/comments/zmbjou/vietnam_carries_out_substantial_expansion_in/j0dmb71/,,,,,,unknown,,,,,Fancy_Toe_5088,Fancy_Toe_5088,,,1.0,from 2022-12-09 to 2022-12-15
"sentiment_general, topics_general, language_general, image_analysis, emotion_analysis, entities",,,,,Somebody only received a 51% cheque eh?,,,,,,,www.reddit.com/r/singapore,,0,,,,j0dk612,,,0,,,,"china, meet, asean, halfway, south, china, code, conduct, george, yeo",en,,1.0,,,,2022-12-15,0_87317_126_t1_j0dk612,0_87317_126_t3_zmnjkl,,,,,,,0.0,,REDDIT,,,China should meet Asean 'more than halfway' on South China Sea code of conduct: George Yeo,,2022-12-15,https://www.reddit.com/r/singapore/comments/zmnjkl/china_should_meet_asean_more_than_halfway_on/j0dk612/,,,,,,unknown,,,,,hibaricloudz,hibaricloudz,,,1.0,from 2022-12-09 to 2022-12-15
"sentiment_general, topics_general, language_general, image_analysis, emotion_analysis, entities",,,,,"And to think people lamented when this CCP shill got voted out.

We lost nothing. Nothing at all.",,,,,,,www.reddit.com/r/singapore,sadness,0,,,,j0di4xc,,,0,,,,"china, meet, asean, halfway, south, china, code, conduct, george, yeo",en,,1.0,,,,2022-12-15,0_87317_126_t1_j0di4xc,0_87317_126_t3_zmnjkl,,,,,,,-0.4932574727955986,,REDDIT,,,China should meet Asean 'more than halfway' on South China Sea code of conduct: George Yeo,,2022-12-15,https://www.reddit.com/r/singapore/comments/zmnjkl/china_should_meet_asean_more_than_halfway_on/j0di4xc/,,,,,,unknown,,,,,paperstarred,paperstarred,,,1.0,from 2022-12-09 to 2022-12-15
"sentiment_general, topics_general, language_general, image_analysis, emotion_analysis, entities",,,,,"Untuk Indonesia

Pernyataan bersama UE-ASEAN tentang invasi hanya mengatakan ""sebagian besar anggota"" mengutuk keras perang di Ukraina

TAGAR.id, Brussels, Belgia - Sementara Uni Eropa telah mendorong perlawanan bersama melawan Rusia, negara-negara Asia Tenggara telah terbagi dan berbeda sikap dalam tanggapan mereka terhadap perang di Ukraina.

Eropa dan Perhimpunan Bangsa-bangsa Asia Tenggara (ASEAN) bertemu pada Rabu, 14 Desember 2022, di Brussels itu untuk membahas kerja sama ekonomi yang lebih mendalam, tetapi ajang itu tidak membuahkan kesepakatan bersama untuk mengecam invasi Rusia ke Ukraina.

Pernyataan bersama UE-ASEAN tentang invasi hanya mengatakan ""sebagian besar anggota"" mengutuk keras perang di Ukraina sambil menegaskan ""kebutuhan untuk menghormati kedaulatan, kemerdekaan politik, dan integritas wilayah Ukraina.""

KTT satu hari di Brussels, Belgia, terjadi pada saat konflik di Ukraina berdampak besar pada ekonomi global. Gangguan pasokan energi Rusia setelah invasi Ukraina sejak Februari lalu berdampak buruk pada ekonomi dan inflasi, menaikkan harga untuk segala hal mulai dari bahan pangan hingga energi.

Tanggapan terbagi atas perang Ukraina

Sementara UE telah mendorong front bersama melawan Rusia, negara-negara ASEAN telah terbagi dalam tanggapan yang berbeda terhadap perang di Ukraina.

Vietnam dan Laos, yang memiliki hubungan militer yang kuat dengan Moskow, tetap tidak memihak, sementara Singapura mematuhi sanksi Barat terhadap Rusia.

Dalam pemungutan suara Perserikatan Bangsa-Bangsa bulan Oktober yang mengecam upaya aneksasi Rusia atas wilayah Ukraina, baik Vietnam maupun Laos abstain bersama dengan Thailand.

Pimpinan sembilan dari 10 negara ASEAN dan pemimpin 27 negara Uni Eropa bergabung dalam KTT tersebut, yang juga memperingati 45 tahun hubungan diplomatik. Karena pengecualian junta militer, Myanmar tidak terwakili di KTT tersebut.

Ilustrasi: Pemimpin junta Myanmar tidak diundang ke pertemuan puncak regional Perhimpunan Bangsa-Bangsa Asia Tenggara (ASEAN) bulan November 2022 depan. (Foto: voaindonesia.com/Reuters)

Meningkatkan investasi di Asia Tenggara

KTT UE-ASEAN ini membuahkan komitmen UE untuk mengelontorkan investasi miliaran dolar di Asia Tenggara.

""Kita harus memastikan bahwa kita memiliki posisi yang kuat dalam hubungan kita dengan ASEAN,"" kata Perdana Menteri Belanda Mark Rutte. ""Kami berbicara tentang rantai pasokan di seluruh dunia. Kami berbicara tentang potensi pertumbuhan.""

Presiden Komisi Eropa Ursula von der Leyen mengumumkan komitmen 10 miliar euro hingga 2027 untuk investasi infrastruktur di negara-negara ASEAN. Ditandai di bawah program ""Global Gateway"" UE, ini terutama akan berfokus pada proyek dan konektivitas hijau.

Perdagangan, transformasi hijau dan digital, dan kesehatan termasuk di antara bidang kolaborasi yang dibahas karena kedua belah pihak bertujuan untuk memperkuat ikatan ekonomi melalui lebih banyak perdagangan.

""Di dunia global yang kita tinggali saat ini, sangat penting bagi kita untuk terhubung dengan negara-negara yang berpikiran sama,"" kata Perdana Menteri Estonia Kaja Kallas.

Pada saat yang sama, KKT ini juga membuahkan perjanjian perdagangan antara UE dan ASEAN yang disesuaikan dengan masing-masing negara ASEAN. Perjanjian ini menggantikan upaya UE lebih dari 10 tahun yang lalu untuk perjanjian perdagangan bebas dengan blok tersebut secara keseluruhan.

Laut Cina Selatan dan situasi Myanmar dibahas

Ketegangan dengan Cina atas jalur laut penting untuk perdagangan internasional adalah topik lain yang dibahas oleh kedua belah pihak.

Filipina, anggota ASEAN, dan Cina telah berselisih mengenai klaim atas Laut Cina Selatan yang disengketakan. Namun, Cina terus menjadi mitra dagang terbesar ASEAN, dan banyak negara di kawasan itu khawatir memutuskan hubungan dengan tetangga kuat mereka.

Pembebasan tahanan politik dan penghentian kekerasan di Myanmar juga dituntut dalam pernyataan bersama. Selain itu, KTT ini juga menghasilkan pernyataan bersama yang mengungkapkan ""kekhawatiran mendalam"" tentang ketidakstabilan di semenanjung Korea. [rs/ha (dpa, AP, Reuters, AFP)]/dw.com/id. []",ID,,,,,,tagar.id,,0,,,,f808e49f674ec88fcf7a06eaa04d10e9,"{'title': '', 'url': 'https://www.tagar.id/Asset/uploads2019/1671138026454-pertemuan-asean-dan-uni-eropa.jpg'}","business, man, leadership, group together, people, meeting, cooperation, teamwork, chair, success, partnership",0,,,,"sikap, asean, pertemuan, dengan, uni, eropa, terpecah, soal, invasi, rusia, ke, ukraina",ms,-0.789275,,,113.921327,,2022-12-15,0_87317_16_f808e49f674ec88fcf7a06eaa04d10e9,0,,,,,,,-0.4662353108910953,,ONLINE_NEWS,,,Sikap ASEAN di Pertemuan dengan Uni Eropa Terpecah Soal Invasi Rusia ke Ukraina,,2022-12-16,http://ct.moreover.com/?a=49515613860&p=189&v=1&x=Rny-4giSCexflzwaQS2nZg,,,,,,unknown,0,,,,Syaiful W Harahap,Syaiful W Harahap,,,1.0,from 2022-12-09 to 2022-12-15
"sentiment_general, topics_general, language_general, image_analysis, emotion_analysis, entities",,,,,"Tentu memori kita masih ingat ketika Pemilu 2019 yang sangat menguji rasa persatuan kita. Efek dari dikotomi politik, masyarakat yang terbelah akibat dari perbedaan pilihan politik dari masing masing kubu kubu. Sehingga menghasilkan riak riak polarisasi politik yang efeknya masih terasa sampai sekarang. 

Selain itu kita juga belum bisa terlepas dari ancaman teror yang sewaktu-waktu bisa meledak kapan saja. Teror dari kelompok yang mengatasnamakan Agama sebagai tamengnya dalam melancarkan aksi-aksi kejinya yang menimbulkan korban jiwa yang tak bersalah. 

Tentu  peristiwa Bom di Polsek Astana Anyar beberapa waktu silam sebagaj bukti  yang perlu menjadi evaluasi bersama untuk bisa membaca segala potensi kerawanan yang terjadi.

Mengatasi masalah ancaman Keamanan Nasional bila dikaitkan dengan dengan teori Black Swan yang dikemukakan oleh Nassim Nicholas Taleb seorang Antropolog Asal Lebanon tentang sebuah peristiwa langka yang terjadi di dunia ini dengan ciri berdampak besar, sulit diprediksi dan diluar perkiraan membuat kita harus waspada dalam menghadapi ketidakmungkinan.

Dalam lingkup global kita hari ini juga berada dalam bayang-bayang ancaman Resesi Ekonomi, bahkan Resesi Politik di tahun 2023 nanti. Kenapa demikian?, Semenjak dari Perang Ukraina Rusia yang belum usai hingga hari ini, serta Situasi di Laut China Selatan. Menjadi faktor yang menyebabkan terjadinya resesi tersebut.

Tentunya kita juga perlu belajar dari masa lalu bagaimana great depression menjadi salah satu penyebab meletusnya Perang Dunia II, akibat dari ego yang tinggi dari pemimpin dunia pada saat itu.  Sehingga ekonomi berantakan, perang pun tak dapat dihindari.

Apalagi Berakhirnya Perang Dingin antara Amerika Serikat dan Uni Soviet menjadi penanda pergeseran definisi keamanan bagi negara setiapbbangsa. Seperti yang diungkapkan oleh Barry Buzan ahli Geopolitik Internasional yang mendefinisikan konsep keamanan yang pada awalnya berpusat pada sektor militer saja kemudian berkembang
menjadi sektor militer dan nirmiliter. Sektor-sektor non militer itu seperti ekonomi, sosial-budaya, dan lingkungan. Sehingga Sektor keamanan menjadi issue penting dalam dinamika global hari ini.

Maka tak ayal dalam melihat fenomena global ini harus bisa di antisipasi, agar tak berdampak bagi stabilitas keamanan nasional.

Melihat posisi Indonesia yang hari ini cukup stabil,  setelah  menjadi  tuan rumah KTT G20, dan di tahun 2023 akan menjadi tuan rumah KTT ASEAN sekaligus Ketua ASEAN.

Ini merupakan sebuah prestasi bagi Indonesia yang tiada hentinya mendapatkan kepercayaan dari negara lain untuk memimpin dan memecahkan berbagai macam persoalan yang melanda hari ini. Sebagai tanda untuk aspek keamanan nasional Indonesia relatif stabil.

Namun disisi lain akan menjadi tantangan terberat bagi Indonesia sebagai tuan rumah KTT ASEAN menjelang tahun politik nanti di 2024. Sehingga segala aspek yang berpotensi menganggu stabilitas keamanan negara harus bisa di mitigasi dengan baik oleh pemerintah.

Oleh karena itu berbagai ancaman seperti terorisme, polarisasi politik, kebrutalan KKB di Papua, hingga resesi ekonomi harus diantisipasi secara komprehensif oleh pemerintah, baik dari hulur maupun ke hilirnya. Karena dalam menyelesaikan masalah keamanan tak bisa hanya dilihat dari satu sisi saja, tapi dari berbagai sudut maupun sisi.

Selain itu pemerintah juga harus lebih sering melibatkan masyarakat. Karena Indonesia sebagai negara Pancasila yang memiliki anekaragam bahasa, suku, dan budaya memerlukan partisipasi rakyatnya agar terjadinya pemahaman bersama bahwa menjaga keamanan nasional adalah tugas kita bersama.

*Penulis adalah Co Founder Forum Intelektual Muda",ID,,,,,,rmol.id,,0,,,,ccfa443122672c408d247d72909e9cc3,"{'title': '', 'url': 'https://rmol.id/images/berita/normal/2022/12/922957_03345816122022_ntiss.jpeg'}","portrait, people, one, mammal, man, adult, movie, wear, leader, facial expression, actor, two, cat, stripe, face, business, tiger, zoo, wildlife, head",0,,,,"menakar, ancaman, keamanan, nasional, tahun, 2023",ms,-0.789275,,,113.921327,,2022-12-15,0_87317_16_ccfa443122672c408d247d72909e9cc3,0,,,,,,,0.13322222630182903,,ONLINE_NEWS,,,Menakar Ancaman Keamanan Nasional di tahun 2023,,2022-12-16,http://ct.moreover.com/?a=49515460746&p=189&v=1&x=aA-qkOggmqUvRd0pmMQgVQ,,,,,,,0,,,,,,,,1.0,from 2022-12-09 to 2022-12-15
"sentiment_general, topics_general, language_general, image_analysis, emotion_analysis, entities",,,,,">Can we have a civil discussion and put aside insults for a moment though.

My original comment was only pointing out that an insulting word is being used (really I implore you to go back and read how tactfully I worded it, so as to only be explanatory, and not insulting), so I'm not the one to ask to put insults aside. **You** are defending the usage of a derogatory word... so you're off to a poor start with requesting this, from me.

>See to me the woke culture and PC language is bullshit. It's not real. 

How do you want to have a conversation when you've made up your mind? I can't convince you something is real when you believe it isn't - not that that would be my goal anyway, since that's a faulty premise. I don't actually really understand what you mean when you say that up there. How is it ""not real""?

>It's just this fake thing people do to make themselves feel better. 

Everything is fake. Everything humans do and believe humans made up. We make all the rules and so, as a society, we get to modify and change the rules. Cannabis in Canada used to be illegal, now its not. We can change whatever we want and make the world better in doing so, and language (and as such how it affects how we relate to, and treat each other) can change to. I absolutely used to use the word in question. I used to call the large bedroom in a home the ""master"" bedroom. When it was brought to my attention that I was ignorant to the fact that people may take offense to those (and other) words that I didn't give a second thought to, I stopped using them. It cost me nothing to chance not making another human feel worth less. 

>Even if there was a good goal in the beginning it's lost the plot and has become about shaming people into thinking the way you do. It seems like brainwashing to me.  

That's you resisting change. It's not surprising - change is scary; we, as a species, aren't comfortable with it and don't like it. Words have a massive impact on how we feel and that connection might feel intangible but it's certainly real. Our identities are very important to us, and someone else dictating how we are described or what category we may fall under, for us, without our consent or agreement to those labels, can damage our own perception of ourselves (individually or as groups). It's really a more empathetic and introspective task to consider which words we use and how those may affect others. 

>I know it's fake. 

Again, what is fake? What are you saying is fake? And if you **know** something is ""fake"", how would I convince you its not? 

>I've seen that it is fake and nothing can prove to me otherwise.

Not really sure why I'm wasting my time responding after that sentence. 

>When I was in the Navy PC culture was huge. People were constantly getting in trouble for a harmless joke. Like being restricted to the ship and loosing two months pay because they said a word that isn't PC. Something else happened to. 

I would reeeally need some additional context and details here. Also that's an organization literally implementing militaristic rules of what words can be used, whereas outside of that, in general society, people take offense to certain words because they offer no value beyond hate. There's a plethora of words with which to describe, to exacting specificity, your intent, which aren't rooted in ignorance, bigotry, or hatred, so to most of us who have decided to disuse those certain words we can't really comprehend the inability to let go of using words which are known to be derogatory, in lieu of others that exist, and so their use appears intentionally malicious; A defiant act whose only goal is to display pride in ignorance. 

>We were deployed to the South China Sea to take part in ""anti-piracy operations"". We asked if that included human trafficking and were told if we had the opportunity then yes. A few months in we come across this fishing vessel and go to check it out, because anti piracy actually just means we are policing fishing waters, and this guy jumps of their ship onto our rhib. Fucks himself up bad because it's a drop. We detain the ship and bring the man aboard for medical attention. He tells us that they are enslaved aboard the ship and are beaten if they don't work and even killed. They work 40 hour days. The man begs to be saved. He begs us for his life. He has risked everything for this chance. The fishing vessel is flying under an allied flag. Word comes down that we are to put the man back on the ship to avoid an international incident. We do. We follow the ship to see when they drop the body. We get called off and are told to stop following it. The man is dead. He was likely used as fish bate because the meat is good. The same people who think PC is important would put a doomed man back.

That story, while heartbreaking, is a false equivalence blended with a pretty binary way of seeing human nature. You're employing wilful ignorance and a cognitive dissonance to make that association between the PC-speak enforcers (which, to clarify is an **organization issuing commands to their subordinates**, regarding their conduct, and isn't the same as society in general deciding that we don't want to use hateful language) and their requisite international diplomacy measures which exist only to not begin larger conflicts or straight up war, but it (your story) is truly sickening - I'm so sorry you endured that horror and that that man lives with you to this day. The difference between the navy and social interactions is that I can't reprimand you in any meaningful way (firing, court martial, discharge etc.) for using specific language, but rather I can only speak to you and suggest you do better.

>It's all just to make us feel better about ourselves. The reality is our society is disgusting and just wants to keep the status quo. So it's just not that important to me. It's just a word. I'll stop saying it when that man gets saved. We are a false society. I just don't see why it matters.

It doesn't change until you start changing it brother. It may feel small and insignificant, but it's gotta start somewhere.",,,,,,,www.reddit.com/r/Idiotswithguns,sadness,0,,,,j0d7k16,,,0,,,,"recorded, nokia",en,,1.0,,,,2022-12-15,0_87317_126_t1_j0d7k16,0_87317_126_t3_zlvl1q,,,,,,,-0.25707507834715004,,REDDIT,,,Must have been recorded on a Nokia,"Piracy, Ship, Psychological concepts, Cognitive science, Language, Piracy off the coast of Somalia, Cognition, Psychology, Concepts in metaphysics, Primate behavior, Joke, Interdisciplinary subfields, Prejudice, Issues in ethics, Social psychology, Behavioural sciences",2022-12-15,https://www.reddit.com/r/Idiotswithguns/comments/zlvl1q/must_have_been_recorded_on_a_nokia/j0d7k16/,,,,,,unknown,,,,,Mediocre__at__worst,Mediocre__at__worst,,,1.0,from 2022-12-09 to 2022-12-15
"sentiment_general, topics_general, language_general, image_analysis, emotion_analysis, entities",,,,,"Taiwan has many strategic values in South China Sea and Taiwan Straight, what does Outer Manchuria have other than access to Sea of Okhost? And with Japan occupying Sakhalin and Kuril Island, no Chinese warship or submarine harbored in Vladivostok can reach Pacific without detection",,,,,,,www.reddit.com/r/imaginarymaps,,0,,,,j0d1on0,,,0,,,,"russian, civil, 2023",en,,1.0,,,,2022-12-15,0_87317_126_t1_j0d1on0,0_87317_126_t3_zm9rt7,,,,,,,0.0,,REDDIT,,,"Second Russian Civil War, 2023","Sea of Okhotsk, Warfare, Naval warfare, Water transport, Warships, Ships, Submarines, Shipping, Military, Watercraft, Pacific theatre of World War II, Military operations, Theaters and campaigns of World War II, Conflicts, Ships of the United States, Kuril Islands, Empire of Japan, Japan–United States military relations, Maritime incidents, Shipwrecks, Maritime disasters, Outer Manchuria, Pacific Ocean theatre of World War II, World War II",2022-12-15,https://www.reddit.com/r/imaginarymaps/comments/zm9rt7/second_russian_civil_war_2023/j0d1on0/,,,,,,unknown,,,,,FlyingPoitato,FlyingPoitato,,,1.0,from 2022-12-09 to 2022-12-15
